{
  "schemaVersion": "1.0.0",
  "contacts": [
    {
      "name": "Ada Researcher",
      "organization": "Open Research Lab",
      "email": "ada@example.test",
      "role": "creator",
      "identifier": "https://orcid.org/0000-0001-2345-6789"
    },
    {
      "organization": "Open Research Lab",
      "role": "publisher"
    }
  ],
  "distributions": [
    {
      "identifier": "roads-geojson",
      "title": "Roads GeoJSON",
      "downloadUrl": "https://data.example.test/roads.geojson",
      "mediaType": "application/geo+json",
      "format": "GeoJSON",
      "byteSize": 4096,
      "checksumSha256": "aaaaaaaaaaaaaaaaaaaaaaaaaaaaaaaaaaaaaaaaaaaaaaaaaaaaaaaaaaaaaaaa",
      "license": "CC-BY-4.0"
    }
  ],
  "referenceSystems": [
    {
      "identifier": "EPSG:4326",
      "uri": "http://www.opengis.net/def/crs/EPSG/0/4326"
    }
  ],
  "lineage": {
    "statement": "Field observations were checked before publication.",
    "sources": [
      "urn:uuid:10000000-0000-4000-8000-000000000001"
    ]
  },
  "quality": [
    {
      "measure": "completeness",
      "result": 0.98,
      "unit": "ratio",
      "description": "Sampled against imagery."
    }
  ],
  "updateFrequency": "annual",
  "sensitivity": "public"
}
